{
  "schema": "phoneManagedSettingsExport",
  "schemaVersion": 1,
  "containsSecrets": false,
  "computerId": "computer-placeholder-01",
  "exportedAtMs": 200000,
  "voice": {
    "activeEngine": "typeless",
    "shortcutOverrides": {
      "typeless": { "dictation": "CTRL+SHIFT+D" }
    }
  },
  "connection": {
    "usbWatchdog": true,
    "lanDiscovery": false,
    "autoStart": true
  }
}
